[
  {
    "id": "380ed28fadb5136d4f37579367bf878062e5c6d204b8b3184be5ce59183deacc",
    "source_url": "https://www.visayanelectric.com/post/service-interruption-october-25-31-2026",
    "fetched_at": "2026-10-29T03:50:38.310Z",
    "advisory_week_start": "2026-10-25",
    "date": "2026-10-25",
    "start_time": "08:00",
    "end_time": "11:00",
    "overnight_span": false,
    "duration_hours": 3,
    "purpose": "To prevent unnecessary interruptions due to anticipated system fault/damage Brgy. Calajo-an , Ward I & Ward II by facilitating Hotspot Correction",
    "city": "Minglanilla",
    "barangay": [
      "Calajo-an"
    ],
    "streets": [
      "18 De Julio Street",
      "A. Apostol Street",
      "Bacay Road",
      "Cebu South Road",
      "Gimenez Street",
      "Lower Tiber Road"
    ],
    "areas_affected_raw": "Portion of Calajo-an , Ward I & Ward II, Minglanilla, along portions of 18 De Julio Street , A. Apostol Street , Bacay Road , Cebu South Road , Gimenez Street, & Lower Tiber Road",
    "lat": 10.23969,
    "lon": 123.8025683,
    "coordinate_source": "osm_point",
    "geocode_query": null,
    "geocode_provider": null,
    "business_confidence": "scheduled",
    "parse_confidence": "high",
    "parse_notes": null
  },
  {
    "id": "4aae69b7daad8193f6b9b803951c0b963a0d38666b39c20955d6b8f12761968b",
    "source_url": "https://www.visayanelectric.com/post/service-interruption-october-25-31-2026",
    "fetched_at": "2026-10-29T03:50:38.310Z",
    "advisory_week_start": "2026-10-25",
    "date": "2026-10-25",
    "start_time": "08:00",
    "end_time": "11:00",
    "overnight_span": false,
    "duration_hours": 3,
    "purpose": "To prevent unnecessary interruptions due to anticipated system fault/damage Brgy. Calajo-an , Ward I & Ward II by facilitating Hotspot Correction",
    "city": "Minglanilla",
    "barangay": [
      "Ward I"
    ],
    "streets": [
      "18 De Julio Street",
      "A. Apostol Street",
      "Bacay Road",
      "Cebu South Road",
      "Gimenez Street",
      "Lower Tiber Road"
    ],
    "areas_affected_raw": "Portion of Calajo-an , Ward I & Ward II, Minglanilla, along portions of 18 De Julio Street , A. Apostol Street , Bacay Road , Cebu South Road , Gimenez Street, & Lower Tiber Road",
    "lat": 10.2445568,
    "lon": 123.7979595,
    "coordinate_source": "osm_point",
    "geocode_query": null,
    "geocode_provider": null,
    "business_confidence": "scheduled",
    "parse_confidence": "high",
    "parse_notes": null
  },
  {
    "id": "c3908d63f6b4c69ed803baa3eaf66f96d71ce8abcb24c3dca5946db29be58c92",
    "source_url": "https://www.visayanelectric.com/post/service-interruption-october-25-31-2026",
    "fetched_at": "2026-10-29T03:50:38.310Z",
    "advisory_week_start": "2026-10-25",
    "date": "2026-10-25",
    "start_time": "08:00",
    "end_time": "11:00",
    "overnight_span": false,
    "duration_hours": 3,
    "purpose": "To prevent unnecessary interruptions due to anticipated system fault/damage Brgy. Calajo-an , Ward I & Ward II by facilitating Hotspot Correction",
    "city": "Minglanilla",
    "barangay": [
      "Ward II"
    ],
    "streets": [
      "18 De Julio Street",
      "A. Apostol Street",
      "Bacay Road",
      "Cebu South Road",
      "Gimenez Street",
      "Lower Tiber Road"
    ],
    "areas_affected_raw": "Portion of Calajo-an , Ward I & Ward II, Minglanilla, along portions of 18 De Julio Street , A. Apostol Street , Bacay Road , Cebu South Road , Gimenez Street, & Lower Tiber Road",
    "lat": 10.2424,
    "lon": 123.7945,
    "coordinate_source": "osm_point",
    "geocode_query": null,
    "geocode_provider": null,
    "business_confidence": "scheduled",
    "parse_confidence": "high",
    "parse_notes": null
  },
  {
    "id": "518e8038a9ecb8fa0994bf474b0e83c6930f089c8aa1a71b1f6b0b3b0f4f188e",
    "source_url": "https://www.visayanelectric.com/post/service-interruption-october-25-31-2026",
    "fetched_at": "2026-10-29T03:50:38.310Z",
    "advisory_week_start": "2026-10-25",
    "date": "2026-10-25",
    "start_time": "15:00",
    "end_time": "18:00",
    "overnight_span": false,
    "duration_hours": 3,
    "purpose": "To prevent unnecessary interruptions due to anticipated system fault/damage Brgy. Mabolo & San Jose by facilitating Hotspot Correction",
    "city": "Cebu City",
    "barangay": [
      "Mabolo"
    ],
    "streets": [
      "A. Soriano Avenue",
      "Juan Luna Avenue Ext",
      "M.J. Cuenco Avenue",
      "Tres Borces Padre Street"
    ],
    "areas_affected_raw": "Portion of Mabolo & San Jose, Cebu City, along portions of A. Soriano Avenue , Juan Luna Avenue Ext. , M.J. Cuenco Avenue, & Tres Borces Padre Street",
    "lat": 10.3142998,
    "lon": 123.9147025,
    "coordinate_source": "osm_point",
    "geocode_query": null,
    "geocode_provider": null,
    "business_confidence": "scheduled",
    "parse_confidence": "high",
    "parse_notes": null
  },
  {
    "id": "678e8e1b01baa5c11ededb2f95026f426717c66bb4072f79fff3f552eb58bd65",
    "source_url": "https://www.visayanelectric.com/post/service-interruption-october-25-31-2026",
    "fetched_at": "2026-10-29T03:50:38.310Z",
    "advisory_week_start": "2026-10-25",
    "date": "2026-10-25",
    "start_time": "15:00",
    "end_time": "18:00",
    "overnight_span": false,
    "duration_hours": 3,
    "purpose": "To prevent unnecessary interruptions due to anticipated system fault/damage Brgy. Mabolo & San Jose by facilitating Hotspot Correction",
    "city": "Cebu City",
    "barangay": [
      "San Jose"
    ],
    "streets": [
      "A. Soriano Avenue",
      "Juan Luna Avenue Ext",
      "M.J. Cuenco Avenue",
      "Tres Borces Padre Street"
    ],
    "areas_affected_raw": "Portion of Mabolo & San Jose, Cebu City, along portions of A. Soriano Avenue , Juan Luna Avenue Ext. , M.J. Cuenco Avenue, & Tres Borces Padre Street",
    "lat": 10.3790912,
    "lon": 123.9164422,
    "coordinate_source": "osm_point",
    "geocode_query": null,
    "geocode_provider": null,
    "business_confidence": "scheduled",
    "parse_confidence": "high",
    "parse_notes": null
  },
  {
    "id": "fa6d7bf6449a5ebd1251c2e51df58d3823c96a18ab4a2924ad31ee5f4ff557dd",
    "source_url": "https://www.visayanelectric.com/post/service-interruption-october-25-31-2026",
    "fetched_at": "2026-10-29T03:50:38.310Z",
    "advisory_week_start": "2026-10-25",
    "date": "2026-10-25",
    "start_time": "09:00",
    "end_time": "12:00",
    "overnight_span": false,
    "duration_hours": 3,
    "purpose": "To prevent unnecessary interruptions due to anticipated system fault/damage Brgy. Bulacao , Inayawan by facilitating Hotspot Correction",
    "city": "Cebu City",
    "barangay": [
      "Bulacao"
    ],
    "streets": [
      "Natalio B. Bacalso Ave"
    ],
    "areas_affected_raw": "Portion of Bulacao , Inayawan, Talisay City & Cebu City, along portion of Natalio B. Bacalso Ave.",
    "lat": 10.2754986,
    "lon": 123.8513835,
    "coordinate_source": "osm_point",
    "geocode_query": null,
    "geocode_provider": null,
    "business_confidence": "scheduled",
    "parse_confidence": "high",
    "parse_notes": null
  },
  {
    "id": "ba6cbc731c7d5e68fc74371db2a867205c98ec20b643b556e29cf662d830ffab",
    "source_url": "https://www.visayanelectric.com/post/service-interruption-october-25-31-2026",
    "fetched_at": "2026-10-29T03:50:38.310Z",
    "advisory_week_start": "2026-10-25",
    "date": "2026-10-25",
    "start_time": "09:00",
    "end_time": "12:00",
    "overnight_span": false,
    "duration_hours": 3,
    "purpose": "To prevent unnecessary interruptions due to anticipated system fault/damage Brgy. Bulacao , Inayawan by facilitating Hotspot Correction",
    "city": "Cebu City",
    "barangay": [
      "Inayawan"
    ],
    "streets": [
      "Natalio B. Bacalso Ave"
    ],
    "areas_affected_raw": "Portion of Bulacao , Inayawan, Talisay City & Cebu City, along portion of Natalio B. Bacalso Ave.",
    "lat": 10.2702421,
    "lon": 123.8563842,
    "coordinate_source": "osm_point",
    "geocode_query": null,
    "geocode_provider": null,
    "business_confidence": "scheduled",
    "parse_confidence": "high",
    "parse_notes": null
  },
  {
    "id": "5d95543981df70edcaa082364c593ac7515e32fd110afe86dd9f8d46f6d8c7bc",
    "source_url": "https://www.visayanelectric.com/post/service-interruption-october-25-31-2026",
    "fetched_at": "2026-10-29T03:50:38.310Z",
    "advisory_week_start": "2026-10-25",
    "date": "2026-10-25",
    "start_time": "14:00",
    "end_time": "17:00",
    "overnight_span": false,
    "duration_hours": 3,
    "purpose": "To prevent unnecessary interruptions due to anticipated system fault/damage Brgy. Linao & Mohon by facilitating Hotspot Correction",
    "city": "Talisay City",
    "barangay": [
      "Linao"
    ],
    "streets": [
      "Fidel Bas Street",
      "Mohon Road"
    ],
    "areas_affected_raw": "Portion of Linao & Mohon, Talisay City, along portions of Fidel Bas Street & Mohon Road",
    "lat": 10.2623108,
    "lon": 123.8181609,
    "coordinate_source": "osm_point",
    "geocode_query": null,
    "geocode_provider": null,
    "business_confidence": "scheduled",
    "parse_confidence": "high",
    "parse_notes": null
  },
  {
    "id": "0c02fb16f546d7791ed7d7e76549132b9394e7d1ed691a72bb1ea6189bb8a0c7",
    "source_url": "https://www.visayanelectric.com/post/service-interruption-october-25-31-2026",
    "fetched_at": "2026-10-29T03:50:38.310Z",
    "advisory_week_start": "2026-10-25",
    "date": "2026-10-25",
    "start_time": "14:00",
    "end_time": "17:00",
    "overnight_span": false,
    "duration_hours": 3,
    "purpose": "To prevent unnecessary interruptions due to anticipated system fault/damage Brgy. Linao & Mohon by facilitating Hotspot Correction",
    "city": "Talisay City",
    "barangay": [
      "Mohon"
    ],
    "streets": [
      "Fidel Bas Street",
      "Mohon Road"
    ],